Tissue,Expected,Observed,Enrichment Fold Change,P value,Q value
late larval arrest WBPhenotype:0000056,2.2422723098002018,16,7.135618599966426,1.1133462599031082e-10,1.3986762059084276e-10
stress induced lethality variant WBPhenotype:0000139,1.1698812051131489,12,10.257451737451737,1.226975281028807e-10,1.5337191012860088e-10
backward point velocity increased WBPhenotype:0002325,2.573738651248927,17,6.6051772551772565,1.2525028240654172e-10,1.557839333414698e-10
sexually dimorphic development variant WBPhenotype:0000930,1.7743198277549423,14,7.89034749034749,2.842619456498808e-10,3.51809338675595e-10
dauer defective WBPhenotype:0000013,1.0333950645166148,11,10.644525387921613,3.66839408842066e-10,4.5177267098776603e-10
maternal effect lethal emb WBPhenotype:0000052,3.451149555083789,19,5.505411949479745,3.721073380496953e-10,4.5601389466874424e-10
organelle metabolism variant WBPhenotype:0001283,1.3258653657949018,12,9.05069270951624,6.449521016739784e-10,7.865269532609493e-10
nuclei small WBPhenotype:0001792,3.19767529397594,18,5.629089368113759,6.639535339172183e-10,8.057688518412842e-10
chemical hypersensitive WBPhenotype:0001918,1.6963277474140657,13,7.663613367061643,1.5431479791289233e-09,1.8637052888030476e-09
somatic transgene silencing variant WBPhenotype:0001595,2.008296068777572,14,6.971083705064287,1.7024912942725261e-09,2.046263574846786e-09
pleiotropic defects severe early emb WBPhenotype:0000270,2.3592604303115166,15,6.357924630651904,2.0985081885746533e-09,2.51017725906059e-09
diplotene absent during oogenesis WBPhenotype:0001954,2.086288149118449,14,6.710482445061883,2.9244218408923662e-09,3.4814545724909122e-09
mid larval arrest WBPhenotype:0001019,1.0138970444313955,10,9.862934362934364,4.3165944754049166e-09,5.114448430574546e-09
gonad small WBPhenotype:0001957,1.5403435867323125,12,7.790469674013978,4.451892430944988e-09,5.249873149699279e-09
no oocytes WBPhenotype:0000291,3.9970941174699246,19,4.753453244184952,4.915463245841186e-09,5.769323058499045e-09
actin organization biogenesis variant WBPhenotype:0001587,1.0528930846018338,10,9.497640497640498,6.601416702284173e-09,7.711935399864687e-09
P granule defective WBPhenotype:0001301,1.0918891247722722,10,9.158439051296194,9.90993106690025e-09,1.152317565918634e-08
spermatogenesis variant WBPhenotype:0000670,1.3648614059653401,11,8.059426365140652,1.0789771919507471e-08,1.2488161943874389e-08
excess intestinal cells WBPhenotype:0001636,2.027794088862791,13,6.4109073359073365,1.668956500863718e-08,1.9227609456955276e-08
tumorous germline WBPhenotype:0001038,1.7743198277549423,12,6.76315499172642,2.6065503609905336e-08,2.989163258016667e-08
germ cell mitosis variant WBPhenotype:0001215,1.208877245283587,10,8.27213849794495,3.040414911281301e-08,3.4707932777183805e-08
paraquat resistant WBPhenotype:0000461,1.8523119080958188,12,6.47839057102215,4.415396129145318e-08,5.017495601301498e-08
spontaneous mutation rate increased WBPhenotype:0000228,1.8523119080958188,12,6.47839057102215,4.415396129145318e-08,5.017495601301498e-08
nicotine response variant WBPhenotype:0001573,1.2673713055392444,10,7.890347490347491,5.076229186923194e-08,5.716474309598191e-08
embryonic cell morphology variant WBPhenotype:0000770,2.9831970730385295,15,5.0281626163979105,6.274403543121066e-08,7.034084689597606e-08
path curvature decreased WBPhenotype:0002337,1.9887980486923529,12,6.033795139677492,1.0436478570927844e-07,1.164785554791054e-07
forward point velocity increased WBPhenotype:0002322,2.378758450396736,13,5.465035761757073,1.2974045694998798e-07,1.4415606327776444e-07
oocytes disorganized WBPhenotype:0001925,1.3843594260505594,10,7.22355756158573,1.3053890652525106e-07,1.444014452712954e-07
variable cell division timing WBPhenotype:0002390,1.4233554662209975,10,7.025651874966944,1.7508792204970447e-07,1.9282810798425602e-07
dead eggs laid WBPhenotype:0000274,1.7743198277549423,11,6.199558742415885,2.19864784997337e-07,2.410798081111152e-07
antibody subcellular localization variant WBPhenotype:0001403,1.2283752653688063,9,7.326751241036955,3.842659018450019e-07,4.1950425965611565e-07
nonsense mRNA accumulation WBPhenotype:0000508,2.2422723098002018,12,5.35171394997482,4.318042426924391e-07,4.693524377091729e-07
meiosis defective early emb WBPhenotype:0001041,1.618335667073189,10,6.179187793645625,6.651465805737254e-07,7.198556066815209e-07
epithelial cell physiology variant WBPhenotype:0000986,1.0333950645166148,8,7.741473009397537,8.126248178429845e-07,8.756732950894231e-07
polar body defective early emb WBPhenotype:0001147,1.6768297273288466,10,5.963634731076591,9.558974363485732e-07,1.0256410261250783e-06
spindle orientation variant WBPhenotype:0001681,1.8913079482662571,10,5.287346256418421,3.1988532706984838e-06,3.417578280660773e-06
amplitude of sinusoidal movement increased WBPhenotype:0002328,1.0333950645166148,7,6.773788883222845,8.323633474024013e-06,8.85492922768512e-06
nose movement increased WBPhenotype:0002303,1.4233554662209975,8,5.620521499973555,1.2566808478197881e-05,1.3312297116735045e-05
everted vulva WBPhenotype:0000696,1.4233554662209975,8,5.620521499973555,1.2566808478197881e-05,1.3312297116735045e-05
pronuclear migration defective early emb WBPhenotype:0001152,1.6963277474140657,8,4.716069764345627,5.20746638953465e-05,5.470027720099422e-05
late larval lethal WBPhenotype:0000058,2.573738651248927,10,3.885398385398386,6.002675582490057e-05,6.278949354069097e-05
fewer germ cells WBPhenotype:0000684,1.7743198277549423,8,4.50876999448428,7.424706615614923e-05,7.734069391265545e-05
cytoplasmic appearance variant WBPhenotype:0001427,2.6517307315898035,10,3.7711219622984333,7.870862128236788e-05,8.164794738834843e-05
transgene induced cosuppression variant WBPhenotype:0000744,1.4428534863062168,7,4.851497443389335,9.871083706080024e-05,0.00010197400522809942
spindle position variant WBPhenotype:0002416,1.2868693256244634,6,4.662478062478063,0.00030159339553058524,0.0003102812711220013
mid larval lethal WBPhenotype:0000116,2.554240631163708,8,3.132046332046332,0.0011239573042983494,0.0011515955986663416
cell cycle defective early emb WBPhenotype:0001114,1.871809928181038,6,3.205453667953668,0.0027931827380304063,0.0028501864673779655
ectopic cleavage furrows early emb WBPhenotype:0001132,1.1113871448574912,4,3.5991058727900835,0.005065464960735568,0.005147830244649968
one cell arrest early emb WBPhenotype:0000040,1.1113871448574912,3,2.6993294045925627,0.02513660844052957,0.02544191137705422
