Tissue,Expected,Observed,Enrichment Fold Change,P value,Q value
cell fate transformation WBPhenotype:0000414,0.6775373774786576,3,4.4277999999999995,0.004888347302538495,0.006020132145983368
pericellular component development variant WBPhenotype:0000200,0.6843127512534442,3,4.383960396039604,0.0050631761965945574,0.006204872789944311
diplotene absent during oogenesis WBPhenotype:0001954,0.7249649939021636,3,4.138130841121495,0.0062005840427426,0.007524980634396358
aneuploidy WBPhenotype:0001882,1.1585889154885045,4,3.452475633528265,0.006409603877755234,0.0077410674852116355
maternal effect lethal emb WBPhenotype:0000052,1.199241158137224,4,3.335442561205273,0.00738596640430356,0.008792817147980428
meiotic chromosome segregation variant WBPhenotype:0001499,1.2602195221103032,4,3.1740501792114695,0.009037837582108204,0.010708338367426781
pleiotropic defects severe early emb WBPhenotype:0000270,0.8198202267491757,3,3.6593388429752065,0.00948379037559889,0.01107863027817152
cytoplasmic appearance variant WBPhenotype:0001427,0.9214508333709742,3,3.255735294117647,0.014071029781170238,0.01613650204262642
