Tissue,Expected,Observed,Enrichment Fold Change,P value,Q value
pathogen susceptibility increased WBPhenotype:0001013,4.526011560693641,16,3.535121328224777,2.5839427994515794e-06,0.0006434017570634432
nuclear division variant WBPhenotype:0000504,5.7500272657868905,16,2.7825955009294034,6.130982817692221e-05,0.007633073608026816
epithelial cell physiology variant WBPhenotype:0000986,1.5086705202312138,7,4.63984674329502,0.00011304517479734392,0.009382749508179545
enzyme activity variant WBPhenotype:0000727,1.5940669647726033,7,4.391283524904215,0.00016830407733166056,0.010476928813895869
meiotic chromosome segregation variant WBPhenotype:0001499,5.294579561566147,13,2.455341325752894,0.0008450940108374786,0.042085681739706435
dauer constitutive WBPhenotype:0000012,3.7005125967935433,10,2.702328323017978,0.001173580459868308,0.04870358908453478
embryonic cell morphology variant WBPhenotype:0000770,4.355218671610862,11,2.525705556807653,0.0013790942149582818,0.04905635136065888
