Tissue,Expected,Observed,Enrichment Fold Change,P value,Q value
organ system physiology variant WBPhenotype:0000575,12.315160275230738,92,7.470467127012383,5.654322388118307e-57,1.4135805970295768e-54
fertility reduced WBPhenotype:0001384,10.63790896908924,78,7.3322680450308395,6.559091264412827e-47,8.198864080516034e-45
embryonic development variant WBPhenotype:0000749,11.360013249619826,77,6.778161108445616,8.131836604030398e-44,6.776530503358664e-42
behavior variant WBPhenotype:0000517,9.702455696583705,68,7.008534965425632,2.7110616002994654e-39,1.6944135001871658e-37
movement variant WBPhenotype:0001206,6.469397895117214,51,7.883268400988647,1.0430948774201357e-31,5.215474387100678e-30
developmental timing variant WBPhenotype:0000033,6.938765677462095,51,7.350010415491307,2.9058248421090354e-30,1.2107603508787647e-28
body morphology variant WBPhenotype:0000072,4.437659033078881,41,9.239105504587155,2.7215724674699792e-28,9.71990166953564e-27
transgene expression increased WBPhenotype:0001236,3.216646340545342,34,10.570014978468452,1.320104551210406e-25,4.1253267225325186e-24
endocytic transport variant WBPhenotype:0001421,2.7604077269373803,31,11.23022504881694,2.721433557159082e-24,7.559537658775228e-23
brood size variant WBPhenotype:0000673,3.89608082268094,35,8.983386534552453,6.151380268967404e-24,1.537845067241851e-22
lipid metabolism variant WBPhenotype:0000725,2.514235813120135,29,11.534319831365128,3.564446599074582e-23,8.101014997896777e-22
developmental growth variant WBPhenotype:0001015,6.12147492358884,35,5.71757630912266,1.3707661793042354e-17,2.85576287355049e-16
transgene subcellular localization variant WBPhenotype:0000679,3.945315205444389,28,7.0970248362820385,8.60644715719268e-17,1.6550859917678229e-15
fat content reduced WBPhenotype:0001183,1.5197012812984627,19,12.502457051142331,1.3522721258528456e-16,2.4147716533086527e-15
acetylcholinesterase inhibitor response variant WBPhenotype:0001290,0.9715584865320626,15,15.439111703446565,5.089195630005754e-15,8.481992716676258e-14
cell death variant WBPhenotype:0000729,2.563470195883584,21,8.192020345593159,2.5352803630686267e-14,3.961375567294729e-13
pigmentation variant WBPhenotype:0000521,1.5393950344038423,17,11.043299231235697,3.545773887263472e-14,5.214373363622753e-13
muscle system morphology variant WBPhenotype:0000603,0.836984506978635,13,15.531948192120884,2.1612919074823327e-13,3.0017943159476843e-12
progeny variant WBPhenotype:0000069,2.5798816568047336,20,7.752293577981652,2.768394897476518e-13,3.642624865100681e-12
oocyte physiology variant WBPhenotype:0001424,2.455154553803996,19,7.738820340479812,1.031387177567148e-12,1.2892339719589351e-11
oxygen response variant WBPhenotype:0000464,0.23632503726455575,8,33.85168195718654,2.6643167167447107e-12,3.1718056151722745e-11
accumulated germline cell corpses WBPhenotype:0001180,0.8238553382417152,12,14.565663949705765,3.310537094519811e-12,3.76197397104524e-11
hermaphrodite fertility reduced WBPhenotype:0001259,3.393890118493759,21,6.187589835501216,6.369075585821903e-12,6.922908245458591e-11
transgene expression reduced WBPhenotype:0001278,2.504388936567445,18,7.187382014500944,1.3149909593350977e-11,1.323319638136062e-10
protein expression reduced WBPhenotype:0000120,0.5514250869506301,10,18.134829619921366,1.2703868526106194e-11,1.323319638136062e-10
thin WBPhenotype:0000164,1.1947543550596986,13,10.880897771952817,2.573182967328613e-11,2.316688460169667e-10
small WBPhenotype:0000229,1.4343616845084843,14,9.760439191316944,2.445028210682212e-11,2.316688460169667e-10
hermaphrodite reproductive system morphology variant WBPhenotype:0001335,2.9278046283331074,19,6.489504052330605,2.4093559985764536e-11,2.316688460169667e-10
dauer development variant WBPhenotype:0000308,0.7417980336359667,10,13.480758301534463,3.0662813386739305e-10,2.6433459816154575e-09
foraging behavior variant WBPhenotype:0000662,1.5525242031407622,13,8.373460441841068,7.811681846669898e-10,6.509734872224915e-09
extended life span WBPhenotype:0000061,1.5590887875092219,13,8.338203766296475,8.246382595980122e-10,6.6503085451452595e-09
dauer metabolism variant WBPhenotype:0001547,2.1860065946971408,15,6.861827423754029,9.559987978420492e-10,7.46874060814101e-09
pore forming toxin response variant WBPhenotype:0002058,0.4759323667133415,8,16.80911104080987,1.5429660140604225e-09,1.1689136470154716e-08
eating variant WBPhenotype:0002056,0.47921465889757137,8,16.69398014327008,1.6396813131612778e-09,1.2056480243832924e-08
mRNA levels increased WBPhenotype:0000136,0.47921465889757137,8,16.69398014327008,1.6396813131612778e-09,1.2056480243832924e-08
pericellular component development variant WBPhenotype:0000200,0.33151151060722406,7,21.115405577254972,1.8414218084119512e-09,1.2787651447305217e-08
body wall muscle thick filament variant WBPhenotype:0000782,0.4956261198187211,8,16.14119934382405,2.207587361615009e-09,1.4916130821723035e-08
molt variant WBPhenotype:0002041,0.9256063959528434,10,10.803728284208471,3.135314622048075e-09,2.062706988189523e-08
clear WBPhenotype:0001010,0.7582094945571164,9,11.870070296675802,6.141822807492344e-09,3.9370659022386825e-08
reversal variant WBPhenotype:0002320,1.0306397458482015,10,9.702711389002513,9.526323312561647e-09,5.953952070351029e-08
dauer constitutive WBPhenotype:0000012,0.42669798394989233,7,16.405045871559633,1.3641591542773228e-08,8.318043623642212e-08
chemosensory behavior variant WBPhenotype:0001049,0.6531761446617582,8,12.247844728228298,2.4528004281341915e-08,1.4600002548417806e-07
sinusoidal movement variant WBPhenotype:0004018,1.1488022644804794,10,8.704718217562254,2.889429738435806e-08,1.6799010107184918e-07
egg laying defective WBPhenotype:0000006,0.9157595194001535,9,9.827907664989642,3.663302215619269e-08,2.0814217134200392e-07
sick WBPhenotype:0000032,2.172877425960221,13,5.982850134427229,5.312227226112222e-08,2.951237347840123e-07
velocity of movement variant WBPhenotype:0004025,0.9617116099793727,9,9.358314807276827,5.789588436529098e-08,3.1465154546353795e-07
sluggish WBPhenotype:0000646,0.7221042805305871,8,11.078732276897414,5.803815051106421e-08,3.1465154546353795e-07
distal tip cell migration variant WBPhenotype:0000195,0.5284490416610206,7,13.246310331072994,7.224548101508998e-08,3.762785469535936e-07
protein interaction variant WBPhenotype:0001369,1.887318005932216,12,6.3582289589150385,7.48349470867734e-08,3.818109545243541e-07
dumpy WBPhenotype:0000583,1.2702470752969872,10,7.872484176089894,7.97411743321969e-08,3.987058716609845e-07
sterile F1 WBPhenotype:0001036,0.21334899197494617,5,23.43577981651376,8.201296779101153e-08,4.020243519167232e-07
shortened life span WBPhenotype:0001171,1.4048210548504148,10,7.118344336791563,2.177552627296374e-07,1.010136009313168e-06
mRNA levels reduced WBPhenotype:0000137,0.41028652302874263,6,14.623926605504588,2.139919350500419e-07,1.010136009313168e-06
short WBPhenotype:0000324,0.6072240540825391,7,11.527870071906769,2.1010828993713892e-07,1.010136009313168e-06
neurite morphology variant WBPhenotype:0001398,0.6170709306352289,7,11.343914698418896,2.375515785835851e-07,1.0797799026526596e-06
fat content increased WBPhenotype:0001184,0.8632428444524746,8,9.26738061185335,2.6341905647331934e-07,1.1759779306844613e-06
turning variant WBPhenotype:0002311,0.9091949350316936,8,8.798993144106252,4.066888223359282e-07,1.7837229049821413e-06
protruding vulva WBPhenotype:0000697,2.606139994278573,13,4.988220137268043,4.745271930931534e-07,2.045375832298075e-06
touch resistant WBPhenotype:0000456,0.16411460921149706,4,24.373211009174312,6.835083856784014e-07,2.8962219732135657e-06
organism starvation response variant WBPhenotype:0000147,0.16411460921149706,4,24.373211009174312,6.835083856784014e-07,2.8962219732135657e-06
pattern protein expression variant WBPhenotype:0001408,0.9781230709005225,8,8.178929868850439,7.467953930869053e-07,3.060636856913546e-06
dauer induction variant WBPhenotype:0001539,0.17396148576418688,4,22.99359529167388,9.1837448889228e-07,3.7031229390817743e-06
neuropil development variant WBPhenotype:0000945,0.334793802791454,5,14.934565569347006,1.208526084602524e-06,4.7957384309623975e-06
protein degradation variant WBPhenotype:0001645,0.5415782103979403,6,11.078732276897414,1.3948106670105735e-06,5.448479168010053e-06
odorant positive chemotaxis defective WBPhenotype:0001438,0.19037294668533658,4,21.011388801012338,1.4469683535048833e-06,5.565262898095705e-06
pathogen resistance increased WBPhenotype:0001014,0.34792297152837376,5,14.370997057296174,1.5144332901804831e-06,5.736489735532134e-06
endosome morphology variant WBPhenotype:0002090,1.1028501739012602,8,7.253931847968546,2.0034951094429757e-06,7.475728020309611e-06
serotonin resistant WBPhenotype:0000024,0.21991357634340605,4,18.188963439682322,2.9774360421472564e-06,1.094645603730609e-05
serotonin response variant WBPhenotype:0001232,0.22319586852763598,4,17.921478683216407,3.205185753571005e-06,1.1612991860764511e-05
long WBPhenotype:0000022,0.6302000993721487,6,9.520785550458715,3.808414149225274e-06,1.360147910437598e-05
cell division polarity variant WBPhenotype:0001235,0.23632503726455575,4,16.92584097859327,4.256469075397993e-06,1.4987567166894344e-05
gene expression level reduced WBPhenotype:0000134,0.23960732944878568,4,16.69398014327008,4.557285291659339e-06,1.5823907262706037e-05
body posture amplitude decreased WBPhenotype:0002292,0.4299802761341223,5,11.628440366972477,5.182695952077924e-06,1.774895873999289e-05
body posture amplitude increased WBPhenotype:0002293,0.2560187903699354,4,15.623853211009173,6.32051383507155e-06,2.135308728064713e-05
coiling frequency decreased WBPhenotype:0002299,0.2560187903699354,4,15.623853211009173,6.32051383507155e-06,2.135308728064713e-05
gonad development variant WBPhenotype:0000691,1.6509929686676603,9,5.451264887737794,7.5711728177824446e-06,2.490517374270541e-05
exploded through vulva WBPhenotype:0000038,1.3293283346131262,8,6.018076792388719,9.024554373915506e-06,2.9300501214011383e-05
backward point velocity decreased WBPhenotype:0002324,0.27899483565954497,4,14.337182946573126,9.639179765979626e-06,3.0894806942242396e-05
forward point velocity decreased WBPhenotype:0002321,0.2855594200280049,4,14.007592534008225,1.0800567976020997e-05,3.417901258234493e-05
neuronal outgrowth variant WBPhenotype:0000572,0.7417980336359667,6,8.088454980920678,1.1037292054478831e-05,3.449153767024635e-05
body posture wavelength decreased WBPhenotype:0002295,0.502190704187181,5,9.956377046231335,1.2600963744183646e-05,3.889186340797422e-05
pathogen susceptibility increased WBPhenotype:0001013,0.5218844572925607,5,9.580664704864114,1.5674490363380756e-05,4.778808037616084e-05
spontaneous mutation rate increased WBPhenotype:0000228,0.31181775750184443,4,12.82800579430227,1.657944879335122e-05,4.9938098775154284e-05
cell fate transformation WBPhenotype:0000414,0.32822921842299413,4,12.186605504587156,2.125858891084765e-05,6.326960985371324e-05
apoptosis reduced WBPhenotype:0000182,0.8238553382417152,6,7.282831974852883,2.1673214717110683e-05,6.37447491679726e-05
cadmium response variant WBPhenotype:0001653,0.33151151060722406,4,12.065946044145699,2.2306403774558445e-05,6.484419701906524e-05
patchy coloration WBPhenotype:0001029,0.33151151060722406,4,12.065946044145699,2.2306403774558445e-05,6.484419701906524e-05
paraquat hypersensitive WBPhenotype:0000462,0.16411460921149706,3,18.279908256880734,2.3097845679910183e-05,6.561887977247211e-05
Q neuroblast lineage migration variant WBPhenotype:0000469,0.16411460921149706,3,18.279908256880734,2.3097845679910183e-05,6.561887977247211e-05
somatic transgene silencing variant WBPhenotype:0001595,0.3380760949756839,4,11.831655829696269,2.4522195636127395e-05,6.784089284234411e-05
pesticide response variant WBPhenotype:0000459,0.5645542556875499,5,8.85654469810113,2.442272142324388e-05,6.784089284234411e-05
developmental pigmentation variant WBPhenotype:0001009,0.34464067934414383,4,11.606290956749673,2.690526794756359e-05,7.311214116185758e-05
dauer defective WBPhenotype:0000013,0.17396148576418688,3,17.24519646875541,2.9143255880630715e-05,7.83420857006202e-05
forward locomotion decreased WBPhenotype:0002347,0.3512052637126037,4,11.389350938866501,2.9464309085560868e-05,7.836252416372571e-05
synapse morphology variant WBPhenotype:0000616,0.17724377794841684,3,16.92584097859327,3.13939651809162e-05,8.261569784451631e-05
inhibitor of serotonin uptake variant WBPhenotype:0001598,0.19037294668533658,3,15.758541600759253,4.168646646667246e-05,0.00010844367556607311
late larval arrest WBPhenotype:0000056,0.37746360118644323,4,10.597048264858396,4.1642371417372077e-05,0.00010844367556607311
coiling frequency increased WBPhenotype:0002300,0.38074589337067316,4,10.505694400506169,4.3402689685801215e-05,0.00011072114715765616
sexually dimorphic morphology variant WBPhenotype:0001023,0.6334823915563786,5,7.892879212815515,4.6493380738041955e-05,0.00011740752711626755
stress induced lethality variant WBPhenotype:0000139,0.19693753105379647,3,15.233256880733945,4.766696942974128e-05,0.00011916742357435321
bag of worms WBPhenotype:0000007,0.20350211542225635,3,14.741861497484463,5.4250853109568845e-05,0.00013428428987517042
ectopic expression transgene WBPhenotype:0001276,0.4037219386602828,4,9.907809353322891,5.739360745642037e-05,0.00014067060651083425
Bacillus thuringiensis toxin hypersensitive WBPhenotype:0002057,0.4070042308445127,4,9.827907664989642,5.964651435799134e-05,0.0001447730931019207
early larval lethal WBPhenotype:0000057,1.3161991658762064,7,5.318344048136539,6.083310234544577e-05,0.00014623341909962925
VPC competence variant WBPhenotype:0002017,0.9748407787162925,6,6.154851264943008,6.282217135933243e-05,0.00014957659847460102
backing decreased WBPhenotype:0002344,0.41685110739720255,4,9.595752365816658,6.681652004327174e-05,0.00015758613217752772
RNAi resistant WBPhenotype:0001208,0.41685110739720255,4,9.595752365816658,6.681652004327174e-05,0.00015758613217752772
Pausing increased WBPhenotype:0002310,0.21991357634340605,3,13.641722579761742,7.359048892428024e-05,0.00017034835399138947
organelle metabolism variant WBPhenotype:0001283,0.22319586852763598,3,13.441109012412305,7.798957038713776e-05,0.00017887516143838937
intestinal vacuole WBPhenotype:0001428,0.22319586852763598,3,13.441109012412305,7.798957038713776e-05,0.00017887516143838937
lysosome-related organelle morphology variant WBPhenotype:0002095,1.010945992742822,6,5.9350351483379,7.881734991684012e-05,0.00017887516143838937
rachis wide WBPhenotype:0001943,0.22976045289609587,3,13.057077326343382,8.735715927047556e-05,0.00019499365908588295
somatic gonad morphology variant WBPhenotype:0000977,0.22976045289609587,3,13.057077326343382,8.735715927047556e-05,0.00019499365908588295
embryo osmotic integrity defective early emb WBPhenotype:0000365,0.4431094448710421,4,9.027115188583078,8.920468011307814e-05,0.00019562429849359243
organism oxidative stress resistant WBPhenotype:0001663,0.2527364981857055,3,11.8700702966758,0.00012664001604803025,0.00027530438271310923
eggshell formation variant WBPhenotype:0002075,0.49234382763449114,4,8.12440366972477,0.0001462807232604335,0.00031526017944058944
tail bend angle increased WBPhenotype:0002289,0.2691479591068552,3,11.146285522488252,0.00016159422194517568,0.00034528679902815315
male mating defective WBPhenotype:0001414,0.2691479591068552,3,11.146285522488252,0.00016159422194517568,0.00034528679902815315
oxidative stress response variant WBPhenotype:0000068,0.5153198729241008,4,7.76216911120201,0.00018092168417408562,0.00038008757179429755
developmental delay WBPhenotype:0000848,0.28227712784377496,3,10.627853637721357,0.0001941939240663956,0.0004045706751383242
adult lethal WBPhenotype:0000060,0.29212400439646474,3,10.269611380270076,0.0002215724210446985,0.0004576341045015234
paralyzed WBPhenotype:0000644,0.5382959182137104,4,7.430857014992168,0.00022149490657873735,0.0004576341045015234
tumorous germline WBPhenotype:0001038,0.29868858876492466,3,10.043905635648754,0.00024130079831375599,0.0004904487770604796
dead eggs laid WBPhenotype:0000274,0.29868858876492466,3,10.043905635648754,0.00024130079831375599,0.0004904487770604796
germ cell physiology variant WBPhenotype:0000987,0.3019708809491546,3,9.934732748304747,0.00025162426119805796,0.0005032485223961159
copulation variant WBPhenotype:0000647,0.56127196350332,4,7.126669885723483,0.0002686469195420282,0.0005330296022659289
sexually dimorphic behavior variant WBPhenotype:0000821,0.5645542556875499,4,7.085235758480904,0.00027595902129279646,0.0005432264198677096
egg morphology variant WBPhenotype:0000037,0.31181775750184443,3,9.621004345726702,0.0002844981774883603,0.0005556605029069537
path curvature increased WBPhenotype:0002336,0.31510004968607436,3,9.520785550458715,0.0002961092313785019,0.0005738550995707401
growth rate variant WBPhenotype:0000676,0.3183823418703043,3,9.422633122103472,0.00030805616110295126,0.0005900817101264673
pachytene progression during oogenesis variant WBPhenotype:0001946,0.8960657662947739,5,5.5799475753604195,0.000306842489265763,0.0005900817101264673
germline nuclear positioning variant WBPhenotype:0001952,0.9026303506632338,5,5.539366138448707,0.0003189794785913322,0.0006041278003623716
pericellular component morphology variant WBPhenotype:0000912,0.5908125931613895,4,6.770336391437309,0.00034002875865227726,0.0006391518019779647
path curvature decreased WBPhenotype:0002337,0.334793802791454,3,8.960739341608203,0.0003730265579394772,0.0006959450707826068
mitochondria morphology variant WBPhenotype:0001401,0.36433443244952346,3,8.234192908504836,0.0005137616689544872,0.0009514104980638653
germ cell compartment expansion variant WBPhenotype:0001980,1.4343616845084843,6,4.183045367707262,0.0006531995045901658,0.0011833324358517497
forward point velocity increased WBPhenotype:0002322,0.40043964647605285,3,7.491765679049481,0.0007326139972677312,0.0013082392808352343
oocyte number decreased WBPhenotype:0001944,1.0765918364274207,5,4.644285634370105,0.0008030305404134141,0.001413786162699673
vulval cell induction increased WBPhenotype:0000218,0.7516449101886565,4,5.321661792396138,0.0010078476213884035,0.0017376683127386266
cytoplasmic appearance variant WBPhenotype:0001427,0.44639173705527196,3,6.7205545062061525,0.0010973156428114124,0.0018679026338219657
cell component localization variant WBPhenotype:0002098,0.781185539846726,4,5.120422480918973,0.0011954545043279497,0.002005796148201258
germ cell compartment multinucleate WBPhenotype:0001972,0.5645542556875499,3,5.313926818860678,0.002585906305293002,0.004170816621440325
cytokinesis variant WBPhenotype:0002408,0.9748407787162925,4,4.103234176628672,0.003124496617585841,0.0049127305307953475
avoids bacterial lawn WBPhenotype:0000402,1.4639023141665537,5,3.415528448595055,0.003741994086765866,0.005739254734303476
cell membrane organization biogenesis variant WBPhenotype:0001982,1.063462667690501,4,3.761297995242949,0.004510782293259935,0.006793346827198698
nuclear division variant WBPhenotype:0000504,0.6630230212144481,3,4.524729766554637,0.0045832809380128205,0.006861199009001229
embryonic cell physiology variant WBPhenotype:0000763,1.3030699971392865,4,3.0696739306264877,0.010358532364282552,0.01471382438108317
cytoplasmic processing body variant WBPhenotype:0001794,0.8960657662947739,3,3.347968545216252,0.012886536949000792,0.018099068748596618
