Tissue,Expected,Observed,Enrichment Fold Change,P value,Q value
transgene expression reduced WBPhenotype:0001278,4.493619805867597,18,4.005679335954565,2.7449828041246212e-08,6.835007182270307e-06
cell fate transformation WBPhenotype:0000414,0.5889409968371687,5,8.489814814814816,2.447848878573811e-05,0.001854934794125655
synapse morphology variant WBPhenotype:0000616,0.3180281382920711,4,12.577503429355282,1.4899074651611686e-05,0.001854934794125655
male nervous system morphology variant WBPhenotype:0001358,0.5771621769004254,5,8.66307634164777,2.18106050471695e-05,0.001854934794125655
male nervous system development variant WBPhenotype:0001008,0.4770422074381067,4,8.385002286236853,0.00010702773953542468,0.0047303444731167646
sister cell division timing asynchrony reduced WBPhenotype:0002369,0.46526338750136326,4,8.597280825128927,9.49868368095736e-05,0.0047303444731167646
protein degradation variant WBPhenotype:0001645,0.9717526447813285,5,5.145342312008978,0.0003919131783717575,0.013940911630652517
L1 larval development variant WBPhenotype:0000751,0.7126186061729741,4,5.6131007040097955,0.0006950664005223004,0.0216339417162566
sexually dimorphic morphology variant WBPhenotype:0001023,1.1366561238957356,5,4.398867779696795,0.0008970906333896583,0.024819507523780548
